<!ELEMENT specialaccess (asr|sa|aci)* >
<!ELEMENT asr (asr_adminsection|asr_billsection|asr_contactsection)* >
<!ELEMENT asr_adminsection (CCNA|PON|ICSC|DTSENT|DDD|REQTYP|BAN|BIC_TEL)* >
<!ELEMENT CCNA EMPTY >
 <!ATTLIST CCNA value CDATA #IMPLIED>
<!ELEMENT PON EMPTY >
 <!ATTLIST PON value CDATA #IMPLIED>
<!ELEMENT ICSC EMPTY >
 <!ATTLIST ICSC value CDATA #IMPLIED>
<!ELEMENT DTSENT (DATE|TIME)* >
<!ATTLIST DTSENT type CDATA #IMPLIED>
<!ELEMENT DATE EMPTY >
 <!ATTLIST DATE value CDATA #IMPLIED>
<!ELEMENT TIME EMPTY >
 <!ATTLIST TIME value CDATA #IMPLIED>
<!ELEMENT DDD EMPTY >
 <!ATTLIST DDD value CDATA #IMPLIED>
<!ELEMENT REQTYP (CHAR)* >
<!ATTLIST REQTYP type CDATA #IMPLIED>
<!ATTLIST REQTYP value CDATA #IMPLIED>
<!ELEMENT CHAR EMPTY >
 <!ATTLIST CHAR value CDATA #IMPLIED>
<!ELEMENT BAN EMPTY >
 <!ATTLIST BAN value CDATA #IMPLIED>
<!ELEMENT BIC_TEL (AREA|EXCH|NUMBER)* >
<!ATTLIST BIC_TEL type CDATA #IMPLIED>
<!ELEMENT AREA EMPTY >
 <!ATTLIST AREA value CDATA #IMPLIED>
<!ELEMENT EXCH EMPTY >
 <!ATTLIST EXCH value CDATA #IMPLIED>
<!ELEMENT NUMBER EMPTY >
 <!ATTLIST NUMBER value CDATA #IMPLIED>
<!ELEMENT asr_billsection (BILLNM)* >
<!ELEMENT BILLNM EMPTY >
 <!ATTLIST BILLNM value CDATA #IMPLIED>
<!ELEMENT asr_contactsection (INIT|INIT_TEL_NO|INIT_STREET|INIT_STATE|INIT_ZIP_CODE|DTREC)* >
<!ELEMENT INIT EMPTY >
 <!ATTLIST INIT value CDATA #IMPLIED>
<!ELEMENT INIT_TEL_NO (AREA|EXCH|NUMBER)* >
<!ATTLIST INIT_TEL_NO type CDATA #IMPLIED>
<!ELEMENT INIT_STREET EMPTY >
 <!ATTLIST INIT_STREET value CDATA #IMPLIED>
<!ELEMENT INIT_STATE EMPTY >
 <!ATTLIST INIT_STATE value CDATA #IMPLIED>
<!ELEMENT INIT_ZIP_CODE EMPTY >
 <!ATTLIST INIT_ZIP_CODE value CDATA #IMPLIED>
<!ELEMENT DTREC (DATE|TIME)* >
<!ATTLIST DTREC type CDATA #IMPLIED>
<!ELEMENT sa (adminsection|sa_circuitdetail|sa_location|remarks)* >
<!ELEMENT adminsection (CCNA|PON|ASR_NO)* >
<!ELEMENT ASR_NO EMPTY >
 <!ATTLIST ASR_NO value CDATA #IMPLIED>
<!ELEMENT sa_circuitdetail (SECTLV)* >
<!ELEMENT SECTLV (SECTION)* >
<!ATTLIST SECTLV type CDATA #IMPLIED>
<!ELEMENT SECTION EMPTY >
 <!ATTLIST SECTION value CDATA #IMPLIED>
<!ELEMENT sa_location EMPTY >
 <!ELEMENT remarks (REMARKS)* >
<!ELEMENT REMARKS EMPTY >
 <!ATTLIST REMARKS value CDATA #IMPLIED>
<!ELEMENT aci (adminsection|aci_circuitdetail)* >
<!ELEMENT aci_circuitdetail (CKR)* >
<!ELEMENT CKR EMPTY >
 <!ATTLIST CKR value CDATA #IMPLIED>
